{
    "Job Title": "Data Architect",
    "Company Name": "Remobi",
    "Key Responsibilities": [
        "Designing, creating, deploying, and managing data architecture",
        "Dashboard development and data architecture services",
        "Capturing and delivering requirements for data visualization dashboards/datahubs",
        "Building the data architecture solutions necessary to serve data visualization/datahubs",
        "Designing and developing data pipelines",
        "Building necessary monitoring and testing services",
        "Iterating and refining services based on stakeholder feedback",
        "Building to a production-ready standard",
        "Preparing documentation to facilitate the agile development process and knowledge retention",
        "Ensuring alignment and integration with adjacent data and analytics initiatives"
    ],
    "Required Qualifications": [
        "Proven experience as a Data Architect",
        "Strong knowledge of database management systems (e.g., SQL, NoSQL)",
        "Experience with data modeling tools and methodologies",
        "Proficient in ETL tools and data integration techniques",
        "In-depth understanding of data governance and data quality principles",
        "Familiarity with data security and privacy regulations"
    ],
    "Technical Skills": [
        "Database management systems (e.g., SQL, NoSQL)",
        "Data modeling tools and methodologies",
        "ETL tools",
        "Data integration techniques",
        "Cloud data platform- AWS"
    ],
    "Soft Skills": [
        "Excellent communication and collaboration skills",
        "Strong analytical and problem-solving abilities"
    ],
    "Name of Recruiting Manager": "Sandra P.",
    "Duration": "Until End of Sept 2024 (with a possibility of extending)",
    "Location": "Remote (Candidates Must be in Europe)",
    "Position Type": "Freelance/Contract/B2B",
    "Job description": "About the job\nAbout Remobi:\n\n\n\nWe are building the world's greatest community of remote technologists!\n\n\nToday, organizations that understand the value of remote working will reap the rewards. Because it doesn\u2019t just provide team members with a healthier work-life balance, it gives you the opportunity to access the brightest minds in the world.\n\n\nOur clients access our community to build or extend their existing teams. All are made up of remote, distributed software engineering experts - the best-in-class. Rapidly deployed without compromising on quality.\n\n\nJoin our Remobi community to have access to meaningful, innovative freelance projects and play a key role in shaping how companies operate.\n\n\nDuration: Until End of Sept 2024 (with a possibility of extending)\nStart: ASAP\nLocation: Remote (Candidates Must be in Europe)\nPosition Type: Freelance/Contract/B2B\n\n\nSummary:\n\nAs a Data Architect you will be responsible for designing, creating, deploying, and managing data architecture. This role requires a deep understanding of database design, data integration, data governance, and performance optimization\n\n\nHow You\u2019ll Make An Impact (Responsibilities)\n\n\n\nYou will be responsible for:\n\n\nDashboard development and data architecture services to deliver a robust, production talent acquisition data analysis solution\nCapturing and delivering requirements for data visualization dashboards/datahubs (such as data models, data architecture, database design/build, data sets integration, data pipelines and front-end requirements), working as part of an Agile delivery team (squad), collaborating with business, data and technical colleagues as needed.\nBuilding the data architecture solutions necessary to serve data visualization/datahubs and deploy into production\nDesigning and developing data pipelines to extract, transform, and load the necessary data to meet data visualization/data-hub requirements, including any necessary analyses and calculations\nBuilding necessary monitoring and testing services to ensure an appropriate level of quality can be maintained in production\nIterating and refining services based on stakeholder feedback to ensure alignment with the requirements and product vision.\nBuilding to a production-ready standard, and work with the team on technical dependencies necessary to do so.\nPreparing documentation, such as tickets and a wiki, to facilitate the agile development process and knowledge retention.\nEnsuring alignment and integration with adjacent data and analytics initiatives, to promote reusability and cost-effective-ness.\n\n\nWhat You Bring (Skills, Capabilities)\n\n\n\nYou will:\n\n\nProven experience as a Data Architect\nStrong knowledge of database management systems (e.g., SQL, NoSQL).\nExperience with data modeling tools and methodologies.\nProficient in ETL tools and data integration techniques.\nIn-depth understanding of data governance and data quality principles.\nFamiliarity with data security and privacy regulations.\nExcellent communication and collaboration skills.\nStrong analytical and problem-solving abilities.\nExperience with cloud data platform- AWS\n\n\nMeet the hiring team\nSandra\nSandra P.  Sandra P. is verified\n 3rd\nTalent Acquisition Specialist\nJob poster"
}